<?xml version="1.0" encoding="UTF-8" standalone="no" ?>
<biblio xsi:noNamespaceSchemaLocation="biblio.xsd" xmlns:xsi="http://www.w3.org/2001/XMLSchema-instance">

<livre>
	<titre> Test 1 </titre>
	<auteur>Auteur 1</auteur>
	<tomes><tome nombrePage='3'></tome></tomes>
	<infosEdition>
		<editeur>Lauren</editeur>
		<lieuEdition>Porto Alegre</lieuEdition>
		<lieuImpression>Porto Alegre</lieuImpression>
		<ISBN> 12345678910</ISBN>
	</infosEdition>
	<avis>Cet un bon livre.</avis>
</livre>

<article>
	<titre> Test 2 </titre>
	<auteur>Auteur 2</auteur>
	<infosPublication>
		<pages>5 Ã  15</pages>
		<anneePublication>2017</anneePublication>
		<numeroJournal>123</numeroJournal>
	</infosPublication>
	<avis>Cet un bon article.</avis>
</article>
</biblio>
